{
  "$schema": "common-schema.json",
  "IDMVersion": "1.2 2025-08-10",
  "license": "(c) EMerge Alliance 2025, Licensed CC BY-NC-ND 4.0 -All Rights Reserved",
  "productName": "60kW DC-DC Mobile EV Charger",
  "fileVersion": "0.0",
  "fileDate": "2026-06-09",
  "productIdentifier": "AMP-8002-60",
  "datasheetHyperlink": "https://www.ampernext.com/products/60kw-mobile-dc-dc-ev-charger-dc-input/",
  "description": "This data is taken from https://dcide.app/products/60kw-dc-dc-mobile-ev-charger-amp-8002-60-dc-dc-mobile-ev-charger-676d68cdc8a1498c3e181318#electrical\n",
  "typeSpecificParameters": {
    "converter": {
      "port1": {
        "portName": "Input",
        "frequency": "DC",
        "connectionType": "DC",
        "SOA": {
          "maxVoltage": {
            "value": 820,
            "units": "V"
          },
          "minVoltage": {
            "value": 300,
            "units": "V"
          },
          "maxCurrentIn": {
            "value": 100,
            "units": "A"
          },
          "maxPowerIn": {
            "value": 60,
            "units": "kW"
          },
          "maxVoltageToGround": {
            "value": 1000,
            "units": "V"
          }
        },
        "VIrelationship": {
          "portType": "constantPower"
        },
        "poleLocallyGrounded": "Float",
        "groundWire": "required",
        "connector": {
          "connectionType": "bolt",
          "bolt": "M8 (5/16\")"
        },
        "prechargeProtection": "neither"
      },
      "port2": {
        "portName": "Output",
        "frequency": "DC",
        "connectionType": "DC",
        "VIrelationship": {
          "portType": "batteryChargingPort",
          "chargeCharacteristics": {
            "portType": "batteryCharging",
            "minNominalBattVolts": {
              "value": 150,
              "units": "V"
            },
            "maxNominalBattVolts": {
              "value": 1000,
              "units": "V"
            },
            "maxChargingCurrent": {
              "value": 100,
              "units": "A"
            },
            "outputPowerLimit": {
              "value": 60,
              "units": "kW"
            },
            "chemistry": "Lithium-ion",
            "BMScommunication": {
              "protocol": [
                "ModBus TCP"
              ]
            }
          }
        },
        "poleLocallyGrounded": "Float",
        "groundWire": "offered",
        "connector": {
          "connectionType": "plugAndSocket",
          "type": "CCS1, CCS2, NACS, Chademo",
          "gender": "Free socket"
        }
      },
      "galvanicSeparation": true,
      "transferPowerSetBy": "BMS",
      "mechanical": {
        "size": {
          "units": "mm",
          "length": 870,
          "width": 670,
          "height": 480
        },
        "weight": {
          "value": 100,
          "units": "kg"
        },
        "mountingType": [
          "Free-standing"
        ]
      }
    }
  },
  "environmental": {
    "operatingTemperature": {
      "min": -25,
      "max": 55,
      "unit": "°C"
    },
    "operatingHumidity": {
      "max": 95
    },
    "ingressProtection_IP": "IP54"
  },
  "manufacturer": {
    "coName": "AmperneXt",
    "webHomePageURL": "www.ampernext.com"
  }
}
