{
  "IDMVersion": "1.2 2025-08-10",
  "license": "(c) EMerge Alliance 2025, Licensed CC BY-NC-ND 4.0 -All Rights Reserved",
  "productName": "Hybrid high voltage relay",
  "fileVersion": "0.0",
  "fileDate": "2026-06-09",
  "productIdentifier": "HVR10-N0C1G1-BS02D9-300A",
  "productSeries": "HVR10",
  "datasheetHyperlink": "https://dcide-payload-nyc.nyc3.digitaloceanspaces.com/dcide-production/d-hvr10-en-EZZWZj.pdf",
  "description": "The HVR10 is a hybrid powerful high voltage relay in a compact design. It combines physical isolation of an electro-mechanical contact and state-of-the-art semi-conductor technology. The hybrid, arc-free switching system allows repeated and reliable disconnection, even in the event of an overload, of up to 2 megawatts – 2,000 A/1,000 V. The HVR10 withstands high short circuit currents up to 5,000 A until the fast HV-fuse trips. The compact unit can switch and permanently process 300 A up to 50,000 times, arc-free and wear-free. The innovative self-monitoring function immediately signals critical operating conditions to the controlgear.\",\n  \"manufacturer",
  "typeSpecificParameters": {
    "contactor": {
      "coilACDC": "DC",
      "minDCVolts": {
        "value": 12,
        "units": "V"
      },
      "coilContactIsolationVolts": {
        "value": 4000,
        "units": "V"
      },
      "contactRating": {
        "maxVoltageDC": {
          "value": 900,
          "units": "V"
        },
        "maxSteadyCurrent": {
          "value": 250,
          "units": "A"
        },
        "ampsBreakingCapacity": {
          "value": 2,
          "units": "kA"
        },
        "AEndConnection": {
          "connectionType": "bolt",
          "bolt": "M10 (13/32\")"
        },
        "BEndConnection": {
          "connectionType": "bolt",
          "bolt": "M10 (13/32\")"
        }
      },
      "numberOfPolesNormallyOpen": 1,
      "numberOfPolesNormallyClosed": 0,
      "numberOfPolesChangeover": 0,
      "numberOfPolesMakeBeforeBreak": 0,
      "mechanical": {
        "size": {
          "units": "mm",
          "width": 80,
          "depth": 90,
          "height": 87
        },
        "weight": {
          "value": 550,
          "units": "g"
        },
        "mountingType": [
          "Panel mount"
        ]
      }
    }
  },
  "environmental": {
    "operatingTemperature": {
      "min": -40,
      "max": 85,
      "unit": "°C"
    },
    "operatingHumidity": {
      "max": 85
    }
  },
  "manufacturer": {
    "coName": "E-T-A Elektrotechnische Apparate GmbH",
    "webHomePageURL": "www.e-t-a.co.uk"
  },
  "listingAuthorities": [
    {
      "LAName": "KBA"
    }
  ]
}
