{
  "$schema": "common-schema.json",
  "IDMVersion": "1.2 2025-08-10",
  "license": "(c) EMerge Alliance 2025, Licensed CC BY-NC-ND 4.0 -All Rights Reserved",
  "productName": "Sunshine Solar 3kW Inverter",
  "fileVersion": "0.0",
  "fileDate": "2026-06-10",
  "productIdentifier": "VP3000-48V",
  "productSeries": "Solar inverters",
  "datasheetHyperlink": "https://www.sunshinesolar.co.uk/media/ecom/prodpdf/VP3000.pdf",
  "description": "With a robust 3000W continuous output, the VP3000 is capable of running multiple devices simultaneously, including kitchen appliances, power tools, entertainment systems, and charging equipment. Its pure sine wave output ensures compatibility with delicate electronics such as laptops, medical devices, TVs, and modern charging systems, reducing the risk of interference or damage. \n\nEngineered for reliability, the inverter features advanced protection mechanisms including overload, over-temperature, short-circuit, and low/high voltage safeguards. These built-in protections help maintain safe operation and extend the lifespan of both the inverter and your connected devices. \n\nThe Sunshine VP3000 is designed with efficiency and durability in mind, making it suitable for both mobile and stationary installations. Whether you're upgrading your off-grid setup, powering a mobile workspace, or ensuring dependable backup power, this inverter provides consistent performance when you need it most.\n\n\nKEY FEATURES\n\n3000W continuous output with high surge capacity \nPure sine wave technology for clean, stable power \n12V DC to 230V AC conversion\nSuitable for RVs, caravans, boats & off-grid systems \nSupports sensitive electronics and high-demand appliances \nBuilt-in protection: overload, short circuit, temperature & voltage safeguards \nEfficient, reliable and designed for long-term use .\nSoft Start\nRCD Compatibility - Switchable\nDual AC outlets\nUSB output 5VDC - 2.1A\n*Optional Extra - Remote On/Off Switch*",
  "typeSpecificParameters": {
    "converter": {
      "port1": {
        "portName": "Input",
        "frequency": "DC",
        "SOA": {
          "maxVoltage": {
            "value": 62,
            "units": "V"
          },
          "nomVoltage": {
            "value": 48,
            "units": "V"
          },
          "minVoltage": {
            "value": 43.2,
            "units": "V"
          },
          "maxCurrentIn": {
            "value": 75,
            "units": "A"
          }
        },
        "VIrelationship": {
          "portType": "constantPower"
        },
        "connector": {
          "connectionType": "other",
          "other": "4 x 700mm - 16mm²"
        }
      },
      "port2": {
        "portName": "Output",
        "frequency": "P50",
        "connectionType": "P1S",
        "SOA": {
          "nomVoltage": {
            "value": 240,
            "units": "Vrms"
          },
          "maxPowerOut": {
            "value": 3000,
            "units": "W"
          }
        },
        "VIrelationship": {
          "portType": "constantVoltage",
          "openCctVolts": {
            "value": 240,
            "units": "V"
          }
        },
        "groundWire": "offered",
        "connector": {
          "connectionType": "plugAndSocket",
          "type": "BS.1363",
          "gender": "Socket"
        }
      },
      "transferPowerSetBy": "port2",
      "staticPower": {
        "value": 12,
        "units": "W"
      },
      "transferEfficicency%P1toP2": 90,
      "shortOverload": {
        "peakPower": {
          "value": 4500,
          "units": "W"
        },
        "maxDuration": {
          "value": 10,
          "units": "s"
        }
      },
      "mechanical": {
        "size": {
          "units": "mm",
          "length": 402,
          "width": 220,
          "height": 150
        },
        "weight": {
          "value": 7.95,
          "units": "kg"
        }
      }
    }
  },
  "environmental": {
    "operatingTemperature": {
      "min": -10,
      "max": 50,
      "unit": "°C"
    },
    "operatingHumidity": {
      "min": 20,
      "max": 90
    }
  },
  "manufacturer": {
    "coName": "Sunshine Solar",
    "webHomePageURL": "www.sunshinesolar.co.uk"
  },
  "listingAuthorities": [
    {
      "LAName": "Cenelec",
      "standard": "EN61000-3-2-3, EN55022, EN55024,"
    },
    {
      "LAName": "IEC",
      "standard": "62040-1:2008"
    }
  ]
}
